<?xml version="1.0" encoding="utf-8" standalone="no"?>
<!--
 * ictk - Internet Chess ToolKit
 * More information is available at http://jvarsoke.github.io/ictk
 * Copyright (c) 1997-2014 J. Varsoke <ictk.jvarsoke [at] neverbox.com>
 * 
 * Permission is hereby granted, free of charge, to any person obtaining a copy
 * of this software and associated documentation files (the "Software"), to deal
 * in the Software without restriction, including without limitation the rights
 * to use, copy, modify, merge, publish, distribute, sublicense, and/or sell
 * copies of the Software, and to permit persons to whom the Software is
 * furnished to do so, subject to the following conditions:
 * 
 * The above copyright notice and this permission notice shall be included in
 * all copies or substantial portions of the Software.
 * 
 * THE SOFTWARE IS PROVIDED "AS IS", WITHOUT WARRANTY OF ANY KIND, EXPRESS OR
 * IMPLIED, INCLUDING BUT NOT LIMITED TO THE WARRANTIES OF MERCHANTABILITY,
 * FITNESS FOR A PARTICULAR PURPOSE AND NONINFRINGEMENT. IN NO EVENT SHALL THE
 * AUTHORS OR COPYRIGHT HOLDERS BE LIABLE FOR ANY CLAIM, DAMAGES OR OTHER
 * LIABILITY, WHETHER IN AN ACTION OF CONTRACT, TORT OR OTHERWISE, ARISING FROM,
 * OUT OF OR IN CONNECTION WITH THE SOFTWARE OR THE USE OR OTHER DEALINGS IN
 * THE SOFTWARE.
-->
<!DOCTYPE ictkml SYSTEM "icsevtml.dtd" [
   <!ENTITY common SYSTEM "parserCommon.xml">
   ]>

<icsevtml>
   <!-- tell event ........................................................-->
   <event id="tell" 
          class="Tell"
	  enum="TELL"
	  extends="ICSMessageEvent">

      <description>
         Direct tells to the user through "tell" or "say".
      </description>

      <member id="tell:player"      typeref="player"/>
      <member id="tell:accountType" typeref="accountType"/>
      <member id="tell:message"     typeref="message"     inherit="yes"/>

      <!--parser-->
      <parser id="tell:parser"
              name="Tell"
              protocol="FICS"
              extends="ICSEventParser"
	      detectFake="yes">

         <!-- regex -->
	 <regex>
	    <regexref ref="regex:fics:player"/>
	    <regexref ref="regex:fics:accountType"/>
	    \s(tells\syou|says):\s
	    <regexref ref="regex:fics:message"/>
	 </regex>

         <!-- assignMatches -->
	 <assignMatches format="java">
	    <regexgroup num="2" memberref="tell:player"/>
	    <regexgroup num="3" memberref="tell:accountType"/>
	    <regexgroup num="5" memberref="tell:message"/>
      if ("tells you".equals(m.group(4))) {
         evt.setEventType(ICSEvent.TELL_EVENT);
      }
      else if ("says".equals(m.group(4))) {
         evt.setEventType(ICSEvent.SAY_EVENT);
      }
	 </assignMatches>

         <!-- toNative -->
         <toNative avgLength="20">
	    <code format="java">
      sb.append(evt.getPlayer())
        .append(evt.getAccountType());

      switch (evt.getEventType()) {
         case ICSEvent.TELL_EVENT:
            sb.append(" tells you: ");
            break;

         case ICSEvent.SAY_EVENT:
            sb.append(" says: ");
            break;
      }

      sb.append(evt.getMessage());
	    </code>

	 </toNative>
      </parser>
   </event>
   &common;
</icsevtml>
