<?xml version="1.0" encoding="utf-8" standalone="no"?>
<!--
 * ictk - Internet Chess ToolKit
 * More information is available at http://jvarsoke.github.io/ictk
 * Copyright (c) 1997-2014 J. Varsoke <ictk.jvarsoke [at] neverbox.com>
 * 
 * Permission is hereby granted, free of charge, to any person obtaining a copy
 * of this software and associated documentation files (the "Software"), to deal
 * in the Software without restriction, including without limitation the rights
 * to use, copy, modify, merge, publish, distribute, sublicense, and/or sell
 * copies of the Software, and to permit persons to whom the Software is
 * furnished to do so, subject to the following conditions:
 * 
 * The above copyright notice and this permission notice shall be included in
 * all copies or substantial portions of the Software.
 * 
 * THE SOFTWARE IS PROVIDED "AS IS", WITHOUT WARRANTY OF ANY KIND, EXPRESS OR
 * IMPLIED, INCLUDING BUT NOT LIMITED TO THE WARRANTIES OF MERCHANTABILITY,
 * FITNESS FOR A PARTICULAR PURPOSE AND NONINFRINGEMENT. IN NO EVENT SHALL THE
 * AUTHORS OR COPYRIGHT HOLDERS BE LIABLE FOR ANY CLAIM, DAMAGES OR OTHER
 * LIABILITY, WHETHER IN AN ACTION OF CONTRACT, TORT OR OTHERWISE, ARISING FROM,
 * OUT OF OR IN CONNECTION WITH THE SOFTWARE OR THE USE OR OTHER DEALINGS IN
 * THE SOFTWARE.
-->
<!DOCTYPE icsevtml SYSTEM "icsevtml.dtd" [
   <!ENTITY common SYSTEM "parserCommon.xml">
   ]>

<icsevtml>
   <!-- channel............................................................-->
   <event id="seekClear" 
          class="SeekClear"
	  enum="SEEK_CLEAR"
	  >

      <description>
         This message from the server indicates that all known seeks
	 should be cleared.
      </description>

      <!--pin parser-->
      <parser id="seekClear:parser"
              name="SeekClear"
              protocol="FICS"
              extends="ICSEventParser"
	      detectFake="no">

         <!-- regex -->
	 <regex>
	    &lt;
	    sc>  <!-- 'n' means does not meet formula -->
	 </regex>

         <!-- assignMatches -->
	 <assignMatches format="java">
      //nothing to do
	 </assignMatches>

         <!-- toNative -->
         <toNative avgLength="5">
	    <code format="java">
      sb.append("&lt;sc>");
	    </code>
	 </toNative>
      </parser>
   </event>
   &common;
</icsevtml>
